{
  "id": "rec-20260518-SPUT-001",
  "ticker": "SPUT (U.U/SRUUF)",
  "name": "Sprott铀现货信托",
  "market": "CA",
  "direction": "long",
  "conviction": "high",
  "thesis": {
    "one_liner": "铀是否处于结构性供需缺口的早期阶段——SPUT是最纯的铀价直接敞口？",
    "core_arguments": [
      "Goldman 05/17上修铀需求+17%（SMR 46GW by 2045），DOE $94M加速SMR → 需求侧叙事强化",
      "2024年供给156.5 Mlbs vs需求180 Mlbs，结构性deficit将在2027-2028集中爆发",
      "SPUT直接持有实物铀，NAV有底~$16，比矿商（CCJ/NXE）更纯粹地受益于铀价上涨"
    ],
    "supply_side_logic": "铀矿从发现到投产需10-15年（结构约束），全球仅NXE Arrow一个大型新矿在推进。现有产能（Kazatomprom/Cameco）已满负荷，无法快速响应需求增长。Commodity Lag理论（F16）：NXE动工是历史铀价飞涨信号。",
    "consensus_check": {
      "sell_side_consensus": "铀看多共识高但SPUT覆盖少（ETF/信托分析师少）",
      "edge_statement": "选SPUT而非矿商（CCJ/NXE），因为矿商DCF显示Base Case已定价（安全边际为负），而SPUT直接跟铀价，无运营风险"
    }
  },
  "bear_case": {
    "scenarios": [
      {
        "description": "铀价均值回归至$30-40/lb，全球核电重启不及预期",
        "probability": 0.15,
        "downside_pct": -50,
        "severity": 7
      },
      {
        "description": "核事故（类Fukushima）导致全球核电政策逆转",
        "probability": 0.05,
        "downside_pct": -70,
        "severity": 10
      },
      {
        "description": "Kazatomprom超预期增产+二手铀库存释放，短期压制铀价至$60-65",
        "probability": 0.25,
        "downside_pct": -15,
        "severity": 4
      }
    ],
    "max_downside_pct": -15.25,
    "probability_weighted_downside": -11.75,
    "kill_condition": "铀价连续6个月低于$60/lb，或全球核电在建项目取消数>3个/年"
  },
  "valuation": {
    "methodology": "asset_value",
    "target_price": 24.5,
    "current_price": 19.68,
    "upside_pct": 24.5,
    "key_assumptions": [
      "铀价Bull $95(2026)→$200(2030)，Base $90→$170",
      "SPUT NAV直接跟踪铀价，溢价/折价率维持历史均值",
      "NAV底部~$16（基于铀价$60/lb下限）"
    ],
    "frameworks_used": ["F1", "F2", "F16"]
  },
  "catalysts": [
    {
      "event": "NXE Arrow矿正式动工",
      "expected_date": "2026年夏",
      "impact": "high",
      "if_positive": "历史铀价飞涨触发信号（F16 Commodity Lag），加仓",
      "if_negative": "动工延期→短期利空铀价，但长期强化供给约束thesis"
    },
    {
      "event": "Goldman Nuclear Nuggets报告后续研究覆盖跟进",
      "expected_date": "2026-Q2/Q3",
      "impact": "medium",
      "if_positive": "更多卖方覆盖提升铀价关注度",
      "if_negative": "无影响，thesis不依赖卖方覆盖"
    },
    {
      "event": "DOE后续拨款/HALEU政策推进",
      "expected_date": "2026-H2",
      "impact": "medium",
      "if_positive": "强化美国核电重启叙事，间接利好铀需求预期",
      "if_negative": "DOGE裁减DOE支持→政策不确定性上升"
    }
  ],
  "position_sizing": {
    "suggested_weight": "3-5%",
    "entry_strategy": "50股@~$19.68已建仓(05/18)",
    "stop_loss": "$16.50（NAV底部附近），或kill_condition触发"
  },
  "metadata": {
    "created_at": "2026-05-18T12:00:00+08:00",
    "analyst": "Nexus Research System",
    "review_date": "2026-07-18",
    "data_freshness": "2026-05-17",
    "confidence_sources": [
      "Goldman Sachs Nuclear Nuggets Report (2026-05-17)",
      "DOE SMR加速拨款公告 (2026-05)",
      "World Nuclear Association 2024 Supply/Demand Data",
      "Sprott Physical Uranium Trust NAV filings"
    ],
    "frameworks_applied": ["F1", "F2", "F16"],
    "system_checks_passed": {
      "bear_case_gate": true,
      "consensus_check": true,
      "source_verified": true,
      "catalyst_dated": true
    }
  },
  "display": {
    "headline": "铀现货信托SPUT：结构性供需缺口的最纯敞口",
    "summary_cn": "全球铀供给156 Mlbs vs需求180 Mlbs，结构性deficit将在2027-2028爆发。SPUT直接持有实物铀，NAV有底$16，比矿商更纯粹受益铀价上涨。Goldman刚上修铀需求+17%，NXE动工是历史铀价飞涨信号。目标$24.5，上行25%，概率加权下行仅-12%。",
    "tags": ["核能", "铀", "大宗商品", "供给约束", "加拿大"],
    "risk_level": "moderate"
  }
}
